Exp5 :

 DML COMMAND- DELETE
1. Delete the record of customer id ‘10001’.
2. Delete all purchase details of items its quantity less than 2.
3. Delete the purchase details of product ‘pen’ in the in_id ‘101’.
4. Delete details of employees who does not have phone number.
5. Delete all records from STUDENT table.
6. Delete Invoice details of a particular customer.
7. Delete the first two records of INVOICE_ITEM table its purchase quantity is high.



--------question 1---------------------------------

mysql> SELECT *FROM CUST;
+-------+---------+---------------+-----------+-----------+
| id    | name    | address       | city      | ph_no     |
+-------+---------+---------------+-----------+-----------+
|     1 | SRUTHI  | THEKKEPURATH  | TVM       | 907456752 |
|     2 | SCISSMO | KOTTARAPATT   | MLP       | 907456753 |
|     3 | AMRUTHA | MADHUCHIRAYIL | TSR       | 907456743 |
|     4 | SARANYA | KANNOTH       | kozhikode | 907456744 |
|     5 | HASNA   | ETTAMTHARAYIL | PKD       | 907456745 |
| 10001 | SRUTHI  | THEKKEPURATH  | TVM       | 907456751 |
+-------+---------+---------------+-----------+-----------+
6 rows in set (0.00 sec)


mysql>delete from CUST where id=10001;
mysql> SELECT *FROM CUST;
+----+---------+---------------+-----------+-----------+
| id | name    | address       | city      | ph_no     |
+----+---------+---------------+-----------+-----------+
|  1 | SRUTHI  | THEKKEPURATH  | TVM       | 907456752 |
|  2 | SCISSMO | KOTTARAPATT   | MLP       | 907456753 |
|  3 | AMRUTHA | MADHUCHIRAYIL | TSR       | 907456743 |
|  4 | SARANYA | KANNOTH       | kozhikode | 907456744 |
|  5 | HASNA   | ETTAMTHARAYIL | PKD       | 907456745 |
+----+---------+---------------+-----------+-----------+
5 rows in set (0.00 sec)






------QUESTION 2---------------------------

mysql> DELETE FROM INOVICE_ITEM WHERE quantity<2;
Query OK, 2 rows affected (0.05 sec)

mysql> select * from INOVICE_ITEM;
+--------+------+----------+
| inv_id | pid  | quantity |
+--------+------+----------+
|   1001 |  101 |        5 |
|   1002 |  101 |        2 |
|   1005 |  104 |        8 |
|   1001 |  101 |        5 |
+--------+------+----------+
4 rows in set (0.00 sec)



------------QUESTION 3--------------------
mysql> select *from INOVICE_ITEM;
+--------+------+----------+
| inv_id | pid  | quantity |
+--------+------+----------+
|   1001 |  101 |        5 |
|   1002 |  101 |        2 |
|   1005 |  104 |        8 |
|   1001 |  101 |        5 |
+--------+------+----------+
4 rows in set (0.00 sec)

mysql>DELETE FROM INOVICE_ITEM WHERE inv_id=1001 and pid=101;
mysql> select *from INOVICE_ITEM;
+--------+------+----------+
| inv_id | pid  | quantity |
+--------+------+----------+
|   1002 |  101 |        2 |
|   1005 |  104 |        8 |
+--------+------+----------+
2 rows in set (0.00 sec)






-------------question 4---------------------------------

mysql> delete from CUST where  ph_no is NULL;
Query OK, 1 row affected (0.04 sec)

mysql> select * from CUST;
+----+---------+---------------+-----------+-----------+
| id | name    | address       | city      | ph_no     |
+----+---------+---------------+-----------+-----------+
|  1 | SRUTHI  | THEKKEPURATH  | TVM       | 907456752 |
|  2 | SCISSMO | KOTTARAPATT   | MLP       | 907456753 |
|  3 | AMRUTHA | MADHUCHIRAYIL | TSR       | 907456743 |
|  4 | SARANYA | KANNOTH       | kozhikode | 907456744 |
|  5 | HASNA   | ETTAMTHARAYIL | PKD       | 907456745 |
|  6 | VARUN   | KALLAYIL      | EKM       |      NULL |
+----+---------+---------------+-----------+-----------+
6 rows in set (0.00 sec)


mysql> select * from CUST;
+----+---------+---------------+-----------+-----------+
| id | name    | address       | city      | ph_no     |
+----+---------+---------------+-----------+-----------+
|  1 | SRUTHI  | THEKKEPURATH  | TVM       | 907456752 |
|  2 | SCISSMO | KOTTARAPATT   | MLP       | 907456753 |
|  3 | AMRUTHA | MADHUCHIRAYIL | TSR       | 907456743 |
|  4 | SARANYA | KANNOTH       | kozhikode | 907456744 |
|  5 | HASNA   | ETTAMTHARAYIL | PKD       | 907456745 |
+----+---------+---------------+-----------+-----------+
5 rows in set (0.00 sec)






-----------QUESTION 5-----------------------
mysql> select *from STUDENT;
+---------+---------+------+---------+--------+
| roll_no | name    | AGE  | address | gender |
+---------+---------+------+---------+--------+
|       1 | ANU     |   21 | ADSFG   | F      |
|       2 | SCISSNA |   20 | WDAF    | F      |
|       3 | SCISSMO |   30 | DDWDAF  | F      |
|       4 | AADI    |    3 | DDDWDAF | M      |
|       5 | AASIMA  |    3 | DDWDAF  |        |
+---------+---------+------+---------+--------+
5 rows in set (0.00 sec)
mysql> DELETE FROM STUDENT;
Query OK, 5 rows affected (0.03 sec)

mysql> select *from STUDENT;
Empty set (0.00 sec)



-------QUESTION 6---------------------

mysql> select *from INVOICE_MASTE;
+--------+---------+------------+
| inv_id | cust_id | inv_date   |
+--------+---------+------------+
|   1001 |       1 | 2022-01-01 |
|   1002 |       2 | 2022-01-31 |
|   1003 |       3 | 2022-03-31 |
|   1004 |       4 | 2022-02-28 |
|   1005 |       5 | 2022-05-02 |
+--------+---------+------------+
5 rows in set (0.00 sec)


mysql> DELETE FROM INVOICE_MASTE WHERE cust_id=3;
Query OK, 1 row affected (0.45 sec)

mysql> select *from INVOICE_MASTE;
+--------+---------+------------+
| inv_id | cust_id | inv_date   |
+--------+---------+------------+
|   1001 |       1 | 2022-01-01 |
|   1002 |       2 | 2022-01-31 |
|   1004 |       4 | 2022-02-28 |
|   1005 |       5 | 2022-05-02 |
+--------+---------+------------+
4 rows in set (0.00 sec)



-------------QUESTION 7----------------------
mysql> DELETE FROM INOVICE_ITEM ORDER BY quantity DESC LIMIT 2;
Query OK, 2 rows affected (0.06 sec)

mysql> SELECT * FROM INOVICE_ITEM;
+--------+------+----------+
| inv_id | pid  | quantity |
+--------+------+----------+
|   1002 |  101 |        2 |
|   1001 |  101 |        5 |
|   1001 |  101 |        5 |
|   1002 |  101 |        2 |
|   1002 |  103 |        4 |
+--------+------+----------+
5 rows in set (0.00 sec)



//VERIFIED
